{
  "blueprint_id": "BP-AI-AGENT-01",
  "name": "Production Autonomous AI Agent & Swarm Stack",
  "category": "Multi-Agent Systems & AI Orchestration",
  "target_audience": "AI Engineers, Autonomous System Architects, Applied AI Startups & Enterprise R&D",
  "summary": "Battle-tested, enterprise-grade architecture for building deterministic multi-agent swarms with cyclical graph orchestration, low-latency hybrid vector retrieval, and comprehensive tracing observability.",
  "architecture_overview": "Production AI agents require strict state machines rather than unconstrained loops. By combining LangGraph cyclical state graphs with DSPy algorithmic prompt optimization, Qdrant high-speed vector retrieval, and Langfuse tracing with DeepEval automated evaluation, teams eliminate hallucination loops, maintain sub-second tool execution, and enforce enterprise safety guardrails.",
  "tiers": [
    {
      "tier_id": "framework",
      "name": "Agent Reasoning & Prompt Optimization Framework",
      "purpose": "Define agent persona, structured input/output contracts, and programmatic prompt compilation.",
      "primary_component": {
        "repo": "stanfordnlp/dspy",
        "role": "Algorithmic prompt optimization & assertion-driven module compiler",
        "language": "Python",
        "why_chosen": "Replaces brittle hand-written prompts with self-optimizing pipelines and strict output schema constraints.",
        "trade_offs": "Steeper learning curve than raw OpenAI SDK; requires validation metrics to compile effectively."
      },
      "alternative_components": [
        {
          "repo": "microsoft/autogen",
          "role": "Conversable multi-agent conversation framework",
          "trade_offs": "Highly dynamic conversations can be harder to unit test than static graph nodes."
        },
        {
          "repo": "567-labs/instructor",
          "role": "Pydantic-first structured LLM extraction",
          "trade_offs": "Focuses purely on schema extraction rather than multi-step agent planning."
        }
      ]
    },
    {
      "tier_id": "orchestration",
      "name": "Cyclic State Graph & Multi-Agent Orchestrator",
      "purpose": "Manage multi-agent workflows, branching logic, persistent memory checkpoints, and human-in-the-loop interventions.",
      "primary_component": {
        "repo": "langchain-ai/langgraph",
        "role": "Stateful multi-actor agent orchestrator with cyclical graphs and checkpointing",
        "language": "Python",
        "why_chosen": "Native support for cycles, branching, time-travel debugging, and durable persistence out-of-the-box.",
        "trade_offs": "Requires explicit state schema management; more boilerplate for trivial one-shot tasks."
      },
      "alternative_components": [
        {
          "repo": "crewAIInc/crewAI",
          "role": "Role-playing multi-agent team orchestration",
          "trade_offs": "Higher abstraction level; less granular control over custom state transition hooks."
        },
        {
          "repo": "FoundationAgents/MetaGPT",
          "role": "SOP-driven multi-role software company simulator",
          "trade_offs": "Heavy opinionated software development role structures."
        }
      ]
    },
    {
      "tier_id": "vector_db",
      "name": "High-Performance Vector DB & Hybrid Search",
      "purpose": "Index semantic knowledge embeddings, enterprise documentation, and long-term agent memory with sub-10ms latency.",
      "primary_component": {
        "repo": "qdrant/qdrant",
        "role": "Rust-native vector search engine with payload-based filtering",
        "language": "Rust",
        "why_chosen": "Extremely fast HNSW indexing, rich metadata payload filtering, and lightweight standalone binary deployment.",
        "trade_offs": "Requires dedicated server instance or managed cluster compared to embedded in-memory options."
      },
      "alternative_components": [
        {
          "repo": "milvus-io/milvus",
          "role": "Cloud-native distributed vector database for billion-scale collections",
          "trade_offs": "Significantly heavier operational footprint (requires etcd, MinIO, Pulsar/Kafka)."
        },
        {
          "repo": "chroma-core/chroma",
          "role": "Simple embedded vector database for fast prototyping",
          "trade_offs": "Higher write latency at massive concurrency; optimized for smaller memory scopes."
        }
      ]
    },
    {
      "tier_id": "observability",
      "name": "LLM Observability, Tracing & Guardrail Evaluation",
      "purpose": "Capture full invocation traces, latency breakdowns, token costs, prompt revisions, and automated evaluation metrics.",
      "primary_component": {
        "repo": "langfuse/langfuse",
        "role": "Open-source LLM engineering platform for traces, evaluations, and prompt management",
        "language": "TypeScript / Python",
        "why_chosen": "Full OpenTelemetry-native trace visualization, playground experimentation, cost tracking, and easy self-hosting.",
        "trade_offs": "Requires Postgres and ClickHouse backend for enterprise scale deployments."
      },
      "alternative_components": [
        {
          "repo": "confident-ai/deepeval",
          "role": "Unit testing and CI/CD quality gate evaluation for LLM outputs",
          "trade_offs": "Specialized in testing/eval metrics rather than real-time production request tracing."
        },
        {
          "repo": "Arize-ai/phoenix",
          "role": "AI observability and evals with OpenInference telemetry",
          "trade_offs": "Notebook-centric evaluation focus, different dashboard workflow."
        }
      ]
    }
  ],
  "end_to_end_workflow": "Natural Language Goal -> DSPy Pipeline Compilation -> LangGraph Multi-Agent State Machine -> Qdrant Hybrid Semantic Retrieval -> Tool Invocation via MCP -> Output Verification via DeepEval -> Telemetry Tracing in Langfuse",
  "data_flow_stages": [
    {
      "stage": 1,
      "title": "Goal Ingestion & Constraint Compilation",
      "input": "User goal and runtime execution constraints",
      "output": "Structured Pydantic task graph and compiled prompt signature",
      "tools_involved": ["stanfordnlp/dspy", "567-labs/instructor"],
      "verification": "Ensure prompt signature passes DSPy assertions and zero-shot validation tests."
    },
    {
      "stage": 2,
      "title": "Stateful Multi-Agent Orchestration",
      "input": "Compiled task graph and initial global state",
      "output": "Branching execution steps with intermediate agent checkpointing",
      "tools_involved": ["langchain-ai/langgraph", "crewAIInc/crewAI"],
      "verification": "Detect and short-circuit cyclic infinite loops with max_iterations bounds."
    },
    {
      "stage": 3,
      "title": "Contextual Retrieval & Long-Term Memory",
      "input": "Agent sub-task query and tenant filter metadata",
      "output": "Ranked semantic context chunks with cosine similarity > 0.82",
      "tools_involved": ["qdrant/qdrant"],
      "verification": "Benchmark retrieval recall@k (>0.90) and verify tenant isolation keys."
    },
    {
      "stage": 4,
      "title": "Observability Tracing & Automated Eval Gate",
      "input": "Completed agent state, generation tokens, and tool call logs",
      "output": "Audited trace URL, latency metrics, and G-Eval alignment score",
      "tools_involved": ["langfuse/langfuse", "confident-ai/deepeval"],
      "verification": "Quality gate rejects agent outputs with hallucination score > 0.15."
    }
  ],
  "production_readiness": {
    "sla_target": "99.9% agent API availability with p95 tool execution latency < 2.5s",
    "security_considerations": [
      "Strict sanitization of untrusted web/document content to prevent prompt injection",
      "Scoped ephemeral credentials for all tool executions",
      "Zero egress leakage of internal prompts or system schemas to client responses",
      "Tenant-isolated collection partitioning in Qdrant with API key boundaries"
    ],
    "failure_modes_and_mitigations": [
      {
        "failure_mode": "Agent reasoning loops indefinitely on ambiguous tasks",
        "mitigation": "Enforce strict LangGraph recursion limit and fallback to human-in-the-loop escalation node."
      },
      {
        "failure_mode": "Vector DB latency spikes during peak indexing bursts",
        "mitigation": "Isolate write ingestion into asynchronous background worker queues with Qdrant replication."
      },
      {
        "failure_mode": "LLM provider rate limits or service outage",
        "mitigation": "Deploy LiteLLM proxy router with automatic multi-provider fallback (Anthropic -> OpenAI -> local vLLM)."
      }
    ]
  },
  "quickstart": {
    "setup_commands": [
      "pip install langgraph dspy-ai qdrant-client langfuse deepeval",
      "docker run -d -p 6333:6333 -v qdrant_storage:/qdrant/storage qdrant/qdrant",
      "docker run -d -p 3000:3000 -e DATABASE_URL='postgresql://postgres:postgres@db:5432/langfuse' langfuse/langfuse"
    ],
    "sample_config_or_code": "from langgraph.graph import StateGraph, END\nfrom typing import TypedDict, Annotated\nimport dspy\n\nclass AgentState(TypedDict):\n    input: str\n    plan: list[str]\n    results: dict\n    final_answer: str\n\ndef planner_node(state: AgentState):\n    # DSPy compiled module invocation\n    return {'plan': ['step1_fetch_context', 'step2_synthesize']}\n\ndef executor_node(state: AgentState):\n    return {'results': {'summary': 'Task executed successfully'}}\n\nbuilder = StateGraph(AgentState)\nbuilder.add_node('planner', planner_node)\nbuilder.add_node('executor', executor_node)\nbuilder.set_entry_point('planner')\nbuilder.add_edge('planner', 'executor')\nbuilder.add_edge('executor', END)\ngraph = builder.compile()"
  }
}
